{"alexandria_method_receipt":{"client":"reth/v1.11.3-d6324d6/x86_64-unknown-linux-gnu","format":"alexandria-compound-v3-method-receipt/v1","gates":{"archive_state":"passed","nested_calls":"passed","ordered_storage":"passed","provider_reported_finality":"passed","rpc_modules":"unsupported"},"registry_commit":"f766f51583c23acc33b2a7824654ef2029a96804","release_id":"sha256:73db32c8e4dac528c9352362d6b12cae71af0824d2f69c89aa7ff1edba9321ab","transactions":[{"block_hash":"0xf56dbfce61b5f2ae9b0a7b25a4a2f8cb7c47f716db7abc4f64a0c8dcf914d1e8","block_number":"15412361","call_count":1,"implementation":"0x42f9505a376761b180e27a01ba0554244ed1de7d","implementation_code_sha256":"d1aad13b432628dee82cdaa9142c8ea56c50bf79ff3192ca13d5aa0d96e29168","label":"old","sstore_count":11,"transaction_hash":"0x10a4ec0d64fc459c9945098601a8115c9268fd9a4742cae509ec15adaf1f9f03"},{"block_hash":"0xb50117200075e10d2e1c489595c9c3ccb9b0585d7851fc2d26ea8c0b717f10ca","block_number":"25766757","call_count":2,"implementation":"0x83d491269720ce925f92c6bf9f66b7a0779a293a","implementation_code_sha256":"93ac04f8ffb0962157af92ee7cf7c1583937d013bde1b6d592ec2a726d624b79","label":"recent","sstore_count":22,"transaction_hash":"0x8c02ef7830078c22e8221b91a77c757e95f7e373adcccf132fb128136f224ad3"}]},"alexandria_release_id":"sha256:73db32c8e4dac528c9352362d6b12cae71af0824d2f69c89aa7ff1edba9321ab","component_digests":{"registry":"sha256:3eff07d0c032d8ab1b614d5ee7691b77e198daa31fa824c739ee7056340b848e","response-recent-call-trace":"sha256:fe52855046a956f74756a5c5710889558d17335b12c7031199a79f37cf090ed0","response-recent-implementation-code":"sha256:fb7ba74282e1d0b353322515c8378b437b8ac28cb7a839cf56998c4085e6695a","response-recent-implementation-slot":"sha256:bbe7f7ccd892169f6ee97a8bf8cf2f75b5f85361e1d30839eaf56d05061b73e4","response-recent-opcode-trace":"sha256:9658c3ec9a9befdfa3c05b1c835fb01b932363a1a7818ee69f49e9341f6e44c4","response-recent-prestate-trace":"sha256:161c368768c75d84de8d61e8d1e4d6665ae26420e361dbd997f15ed4b7947b55","upstream-configuration-json":"sha256:28825ee92d6b91d0f3d3bbfbf6d8b39f2761f464722bffe629288f7efd69e6f8","upstream-deploy-ts":"sha256:c08703199b5ac9d03b3f893f35079cdcd8798b21029f81265c4dca790c58f0e2","upstream-relations-ts":"sha256:4080103db97ec31474693ce4c0b9e0722079239eb414ca071761a2c3aedf9ca8","upstream-roots-json":"sha256:689cf0e940bfdc440eba854201d8ed738be5a442802ee5723a05a4b2d16f6c57"},"facts_sha256":"08cc6cac67fb8ec9070d32c97b712047cecbcd255e4218245c3593f7df53d6fe","format":"tabularium-compound-v3-witness/v1","registry_commit":"f766f51583c23acc33b2a7824654ef2029a96804","row_count":11,"scope":"one Ethereum USDC transaction; method proof, not market history","transaction_hash":"0x8c02ef7830078c22e8221b91a77c757e95f7e373adcccf132fb128136f224ad3"}
